title,authors,abstract,submitted_date,pdf_link
Pattern Recognition Techniques for the Identification of Activities of Daily Living using Mobile Device Accelerometer,Ivan Miguel Pires;Nuno M. Garcia;Nuno Pombo;Francisco Flórez-Revuelta;Susanna Spinsante,"This paper focuses on the recognition of Activities of Daily Living (ADL) applying pattern recognition techniques to the data acquired by the accelerometer available in the mobile devices. The recognition of ADL is composed by several stages, including data acquisition, data processing, and artificial intelligence methods. The artificial intelligence methods used are related to pattern recognition, and this study focuses on the use of Artificial Neural Networks (ANN). The data processing includes data cleaning, and the feature extraction techniques to define the inputs for the ANN. Due to the low processing power and memory of the mobile devices, they should be mainly used to acquire the data, applying an ANN previously trained for the identification of the ADL. The main purpose of this paper is to present a new method implemented with ANN for the identification of a defined set of ADL with a reliable accuracy. This paper also presents a comparison of different types of ANN in order to choose the type for the implementation of the final method. Results of this research probes that the best accuracies are achieved with Deep Learning techniques with an accuracy higher than 80%. △ Less","31 October, 2017",https://arxiv.org/pdf/1711.00096
Techreport: Time-sensitive probabilistic inference for the edge,Christian Weilbach;Annette Bieniusa,"In recent years the two trends of edge computing and artificial intelligence became both crucial for information processing infrastructures. While the centralized analysis of massive amounts of data seems to be at odds with computation on the outer edge of distributed systems, we explore the properties of eventually consistent systems and statistics to identify sound formalisms for probabilistic inference on the edge. In particular we treat time itself as a random variable that we incorporate into statistical models through probabilistic programming. △ Less","5 November, 2017",https://arxiv.org/pdf/1710.11057
Detection and Analysis of Human Emotions through Voice and Speech Pattern Processing,Poorna Banerjee Dasgupta,"The ability to modulate vocal sounds and generate speech is one of the features which set humans apart from other living beings. The human voice can be characterized by several attributes such as pitch, timbre, loudness, and vocal tone. It has often been observed that humans express their emotions by varying different vocal attributes during speech generation. Hence, deduction of human emotions through voice and speech analysis has a practical plausibility and could potentially be beneficial for improving human conversational and persuasion skills. This paper presents an algorithmic approach for detection and analysis of human emotions with the help of voice and speech processing. The proposed approach has been developed with the objective of incorporation with futuristic artificial intelligence systems for improving human-computer interactions. △ Less","27 October, 2017",https://arxiv.org/pdf/1710.10198
A Memristor-Based Optimization Framework for AI Applications,Sijia Liu;Yanzhi Wang;Makan Fardad;Pramod K. Varshney,"Memristors have recently received significant attention as ubiquitous device-level components for building a novel generation of computing systems. These devices have many promising features, such as non-volatility, low power consumption, high density, and excellent scalability. The ability to control and modify biasing voltages at the two terminals of memristors make them promising candidates to perform matrix-vector multiplications and solve systems of linear equations. In this article, we discuss how networks of memristors arranged in crossbar arrays can be used for efficiently solving optimization and machine learning problems. We introduce a new memristor-based optimization framework that combines the computational merit of memristor crossbars with the advantages of an operator splitting method, alternating direction method of multipliers (ADMM). Here, ADMM helps in splitting a complex optimization problem into subproblems that involve the solution of systems of linear equations. The capability of this framework is shown by applying it to linear programming, quadratic programming, and sparse optimization. In addition to ADMM, implementation of a customized power iteration (PI) method for eigenvalue/eigenvector computation using memristor crossbars is discussed. The memristor-based PI method can further be applied to principal component analysis (PCA). The use of memristor crossbars yields a significant speed-up in computation, and thus, we believe, has the potential to advance optimization and machine learning research in artificial intelligence (AI). △ Less","18 October, 2017",https://arxiv.org/pdf/1710.08882
Human-in-the-loop Artificial Intelligence,Fabio Massimo Zanzotto,"Little by little, newspapers are revealing the bright future that Artificial Intelligence (AI) is building. Intelligent machines will help everywhere. However, this bright future has a dark side: a dramatic job market contraction before its unpredictable transformation. Hence, in a near future, large numbers of job seekers will need financial support while catching up with these novel unpredictable jobs. This possible job market crisis has an antidote inside. In fact, the rise of AI is sustained by the biggest knowledge theft of the recent years. Learning AI machines are extracting knowledge from unaware skilled or unskilled workers by analyzing their interactions. By passionately doing their jobs, these workers are digging their own graves. In this paper, we propose Human-in-the-loop Artificial Intelligence (HIT-AI) as a fairer paradigm for Artificial Intelligence systems. HIT-AI will reward aware and unaware knowledge producers with a different scheme: decisions of AI systems generating revenues will repay the legitimate owners of the knowledge used for taking those decisions. As modern Robin Hoods, HIT-AI researchers should fight for a fairer Artificial Intelligence that gives back what it steals. △ Less","23 October, 2017",https://arxiv.org/pdf/1710.08191
Characterization of Gradient Dominance and Regularity Conditions for Neural Networks,Yi Zhou;Yingbin Liang,"The past decade has witnessed a successful application of deep learning to solving many challenging problems in machine learning and artificial intelligence. However, the loss functions of deep neural networks (especially nonlinear networks) are still far from being well understood from a theoretical aspect. In this paper, we enrich the current understanding of the landscape of the square loss functions for three types of neural networks. Specifically, when the parameter matrices are square, we provide an explicit characterization of the global minimizers for linear networks, linear residual networks, and nonlinear networks with one hidden layer. Then, we establish two quadratic types of landscape properties for the square loss of these neural networks, i.e., the gradient dominance condition within the neighborhood of their full rank global minimizers, and the regularity condition along certain directions and within the neighborhood of their global minimizers. These two landscape properties are desirable for the optimization around the global minimizers of the loss function for these neural networks. △ Less","20 October, 2017",https://arxiv.org/pdf/1710.06910
Unsupervised Sentence Representations as Word Information Series: Revisiting TF--IDF,Ignacio Arroyo-Fernández;Carlos-Francisco Méndez-Cruz;Gerardo Sierra;Juan-Manuel Torres-Moreno;Grigori Sidorov,"Sentence representation at the semantic level is a challenging task for Natural Language Processing and Artificial Intelligence. Despite the advances in word embeddings (i.e. word vector representations), capturing sentence meaning is an open question due to complexities of semantic interactions among words. In this paper, we present an embedding method, which is aimed at learning unsupervised sentence representations from unlabeled text. We propose an unsupervised method that models a sentence as a weighted series of word embeddings. The weights of the word embeddings are fitted by using Shannon's word entropies provided by the Term Frequency--Inverse Document Frequency (TF--IDF) transform. The hyperparameters of the model can be selected according to the properties of data (e.g. sentence length and textual gender). Hyperparameter selection involves word embedding methods and dimensionalities, as well as weighting schemata. Our method offers advantages over existing methods: identifiable modules, short-term training, online inference of (unseen) sentence representations, as well as independence from domain, external knowledge and language resources. Results showed that our model outperformed the state of the art in well-known Semantic Textual Similarity (STS) benchmarks. Moreover, our model reached state-of-the-art performance when compared to supervised and knowledge-based STS systems. △ Less","19 October, 2017",https://arxiv.org/pdf/1710.06524
On Hashing-Based Approaches to Approximate DNF-Counting,Kuldeep S. Meel;Aditya A. Shrotri;Moshe Y. Vardi,"Propositional model counting is a fundamental problem in artificial intelligence with a wide variety of applications, such as probabilistic inference, decision making under uncertainty, and probabilistic databases. Consequently, the problem is of theoretical as well as practical interest. When the constraints are expressed as DNF formulas, Monte Carlo-based techniques have been shown to provide a fully polynomial randomized approximation scheme (FPRAS). For CNF constraints, hashing-based approximation techniques have been demonstrated to be highly successful. Furthermore, it was shown that hashing-based techniques also yield an FPRAS for DNF counting without usage of Monte Carlo sampling. Our analysis, however, shows that the proposed hashing-based approach to DNF counting provides poor time complexity compared to the Monte Carlo-based DNF counting techniques. Given the success of hashing-based techniques for CNF constraints, it is natural to ask: Can hashing-based techniques provide an efficient FPRAS for DNF counting? In this paper, we provide a positive answer to this question. To this end, we introduce two novel algorithmic techniques: \emph{Symbolic Hashing} and \emph{Stochastic Cell Counting}, along with a new hash family of \emph{Row-Echelon hash functions}. These innovations allow us to design a hashing-based FPRAS for DNF counting of similar complexity (up to polylog factors) as that of prior works. Furthermore, we expect these techniques to have potential applications beyond DNF counting. △ Less","14 October, 2017",https://arxiv.org/pdf/1710.05247
Fast Top-k Area Topics Extraction with Knowledge Base,Fang Zhang;Xiaochen Wang;Jingfei Han;Jie Tang;Shiyin Wang;Marie-Francine Moens,"What are the most popular research topics in Artificial Intelligence (AI)? We formulate the problem as extracting top-k topics that can best represent a given area with the help of knowledge base. We theoretically prove that the problem is NP-hard and propose an optimization model, FastKATE, to address this problem by combining both explicit and latent representations for each topic. We leverage a large-scale knowledge base (Wikipedia) to generate topic embeddings using neural networks and use this kind of representations to help capture the representativeness of topics for given areas. We develop a fast heuristic algorithm to efficiently solve the problem with a provable error bound. We evaluate the proposed model on three real-world datasets. Experimental results demonstrate our model's effectiveness, robustness, real-timeness (return results in <1s), and its superiority over several alternative methods. △ Less","4 December, 2017",https://arxiv.org/pdf/1710.04822
Adapting a Formal Model Theory to Applications in Augmented Personalized Medicine,Plamen L. Simeonov;Andrée C. Ehresmann,"The goal of this paper is to advance an extensible theory of living systems using an approach to biomathematics and biocomputation that suitably addresses self-organized, self-referential and anticipatory systems with multi-temporal multi-agents. Our first step is to provide foundations for modelling of emergent and evolving dynamic multi-level organic complexes and their sustentative processes in artificial and natural life systems. Main applications are in life sciences, medicine, ecology and astrobiology, as well as robotics, industrial automation and man-machine interface. Since 2011 over 100 scientists from a number of disciplines have been exploring a substantial set of theoretical frameworks for a comprehensive theory of life known as Integral Biomathics. That effort identified the need for a robust core model of organisms as dynamic wholes, using advanced and adequately computable mathematics. The work described here for that core combines the advantages of a situation and context aware multivalent computational logic for active self-organizing networks, Wandering Logic Intelligence (WLI), and a multi-scale dynamic category theory, Memory Evolutive Systems (MES), hence WLIMES. This is presented to the modeller via a formal augmented reality language as a first step towards practical modelling and simulation of multi-level living systems. Initial work focuses on the design and implementation of this visual language and calculus (VLC) and its graphical user interface. The results will be integrated within the current methodology and practices of theoretical biology and (personalized) medicine to deepen and to enhance the holistic understanding of life. △ Less","12 November, 2017",https://arxiv.org/pdf/1710.03571
Feasibility Study: Moving Non-Homogeneous Teams in Congested Video Game Environments,Hang Ma;Jingxing Yang;Liron Cohen;T. K. Satish Kumar;Sven Koenig,"Multi-agent path finding (MAPF) is a well-studied problem in artificial intelligence, where one needs to find collision-free paths for agents with given start and goal locations. In video games, agents of different types often form teams. In this paper, we demonstrate the usefulness of MAPF algorithms from artificial intelligence for moving such non-homogeneous teams in congested video game environments. △ Less","3 October, 2017",https://arxiv.org/pdf/1710.01447
Simple Cortex: A Model of Cells in the Sensory Nervous System,David Di Giorgio,"Neuroscience research has produced many theories and computational neural models of sensory nervous systems. Notwithstanding many different perspectives towards developing intelligent machines, artificial intelligence has ultimately been influenced by neuroscience. Therefore, this paper provides an introduction to biologically inspired machine intelligence by exploring the basic principles of sensation and perception as well as the structure and behavior of biological sensory nervous systems like the neocortex. Concepts like spike timing, synaptic plasticity, inhibition, neural structure, and neural behavior are applied to a new model, Simple Cortex (SC). A software implementation of SC has been built and demonstrates fast observation, learning, and prediction of spatio-temporal sensory-motor patterns and sequences. Finally, this paper suggests future areas of improvement and growth for Simple Cortex and other related machine intelligence models. △ Less","3 October, 2017",https://arxiv.org/pdf/1710.01347
What Automated Planning can do for Business Process Management,Andrea Marrella,"Business Process Management (BPM) is a central element of today organizations. Despite over the years its main focus has been the support of processes in highly controlled domains, nowadays many domains of interest to the BPM community are characterized by ever-changing requirements, unpredictable environments and increasing amounts of data that influence the execution of process instances. Under such dynamic conditions, BPM systems must increase their level of automation to provide the reactivity and flexibility necessary for process management. On the other hand, the Artificial Intelligence (AI) community has concentrated its efforts on investigating dynamic domains that involve active control of computational entities and physical devices (e.g., robots, software agents, etc.). In this context, Automated Planning, which is one of the oldest areas in AI, is conceived as a model-based approach to synthesize autonomous behaviours in automated way from a model. In this paper, we discuss how automated planning techniques can be leveraged to enable new levels of automation and support for business processing, and we show some concrete examples of their successful application to the different stages of the BPM life cycle. △ Less","20 October, 2017",https://arxiv.org/pdf/1709.10482
Intelligence Quotient and Intelligence Grade of Artificial Intelligence,Feng Liu;Yong Shi;Ying Liu,"Although artificial intelligence is currently one of the most interesting areas in scientific research, the potential threats posed by emerging AI systems remain a source of persistent controversy. To address the issue of AI threat, this study proposes a standard intelligence model that unifies AI and human characteristics in terms of four aspects of knowledge, i.e., input, output, mastery, and creation. Using this model, we observe three challenges, namely, expanding of the von Neumann architecture; testing and ranking the intelligence quotient of naturally and artificially intelligent systems, including humans, Google, Bing, Baidu, and Siri; and finally, the dividing of artificially intelligent systems into seven grades from robots to Google Brain. Based on this, we conclude that AlphaGo belongs to the third grade. △ Less","4 October, 2017",https://arxiv.org/pdf/1709.10242
Tweeting AI: Perceptions of Lay vs Expert Twitterati,Lydia Manikonda;Subbarao Kambhampati,"With the recent advancements in Artificial Intelligence (AI), various organizations and individuals are debating about the progress of AI as a blessing or a curse for the future of the society. This paper conducts an investigation on how the public perceives the progress of AI by utilizing the data shared on Twitter. Specifically, this paper performs a comparative analysis on the understanding of users belonging to two categories -- general AI-Tweeters (AIT) and expert AI-Tweeters (EAIT) who share posts about AI on Twitter. Our analysis revealed that users from both the categories express distinct emotions and interests towards AI. Users from both the categories regard AI as positive and are optimistic about the progress of AI but the experts are more negative than the general AI-Tweeters. Expert AI-Tweeters share relatively large percentage of tweets about their personal news compared to technical aspects of AI. However, the effects of automation on the future are of primary concern to AIT than to EAIT. When the expert category is sub-categorized, the emotion analysis revealed that students and industry professionals have more insights in their tweets about AI than academicians. △ Less","25 September, 2017",https://arxiv.org/pdf/1709.09534
Angriffserkennung für industrielle Netzwerke innerhalb des Projektes IUNO,Simon Duque Anton;Daniel Fraunholz;Hans Dieter Schotten,"The increasing interconnectivity of industrial networks is one of the central current hot topics. It is adressed by research institutes, as well as industry. In order to perform the fourth industrial revolution, a full connectivity between production facilities is necessary. Due to this connectivity, however, an abundance of new attack vectors emerges. In the National Reference Project for Industrial IT-Security (IUNO), these risks and threats are addressed and solutions are developed. These solutions are especially applicable for small and medium sized enterprises that have not as much means in staff as well as money as larger companies. These enterprises should be able to implement the solutions without much effort. The security solutions are derived from four use cases and implemented prototypically. A further topic of this work are the research areas of the German Research Center for Artificial Intelligence that address the given challenges, as well as the solutions developed in the context of IUNO. Aside from the project itself, a method for distributed network data collection aggregation is presented, as a prerequisite for anomaly detection for network security. △ Less","21 November, 2017",https://arxiv.org/pdf/1709.09455
An enhanced method to compute the similarity between concepts of ontology,Noreddine Gherabi;Abdelhadi Daoui;Abderrahim Marzouk,"With the use of ontologies in several domains such as semantic web, information retrieval, artificial intelligence, the concept of similarity measuring has become a very important domain of research. Therefore, in the current paper, we propose our method of similarity measuring which uses the Dijkstra algorithm to define and compute the shortest path. Then, we use this one to compute the semantic distance between two concepts defined in the same hierarchy of ontology. Afterward, we base on this result to compute the semantic similarity. Finally, we present an experimental comparison between our method and other methods of similarity measuring. △ Less","26 September, 2017",https://arxiv.org/pdf/1709.08880
"Ultra-Dense HetNets Meet Big Data: Green Frameworks, Techniques, and Approaches",Yuzhou Li;Yu Zhang;Kai Luo;Tao Jiang;Zan Li;Wei Peng,"Ultra-dense heterogeneous networks (Ud-HetNets) have been put forward to improve the network capacity for next-generation wireless networks. However, counter to the 5G vision, ultra-dense deployment of networks would significantly increase energy consumption and thus decrease network energy efficiency suffering from the conventional worst-case network design philosophy. This problem becomes particularly severe when Ud-HetNets meet big data because of the traditional reactive request-transmit service mode. In view of these, this article first develops a big-data-aware artificial intelligent based framework for energy-efficient operations of Ud-HetNets. Based on the framework, we then identify four promising techniques, namely big data analysis, adaptive base station operation, proactive caching, and interference-aware resource allocation, to reduce energy cost on both large and small scales. We further develop a load-aware stochastic optimization approach to show the potential of our proposed framework and techniques in energy conservation. In a nutshell, we devote to constructing green Ud-HetNets of big data with the abilities of learning and inferring by improving the flexibility of control from worst-case to adaptive design and shifting the manner of services from reactive to proactive modes. △ Less","25 September, 2017",https://arxiv.org/pdf/1709.08797
"Unsupervised Machine Learning for Networking: Techniques, Applications and Research Challenges",Muhammad Usama;Junaid Qadir;Aunn Raza;Hunain Arif;Kok-Lim Alvin Yau;Yehia Elkhatib;Amir Hussain;Ala Al-Fuqaha,"While machine learning and artificial intelligence have long been applied in networking research, the bulk of such works has focused on supervised learning. Recently there has been a rising trend of employing unsupervised machine learning using unstructured raw network data to improve network performance and provide services such as traffic engineering, anomaly detection, Internet traffic classification, and quality of service optimization. The interest in applying unsupervised learning techniques in networking emerges from their great success in other fields such as computer vision, natural language processing, speech recognition, and optimal control (e.g., for developing autonomous self-driving cars). Unsupervised learning is interesting since it can unconstrain us from the need of labeled data and manual handcrafted feature engineering thereby facilitating flexible, general, and automated methods of machine learning. The focus of this survey paper is to provide an overview of the applications of unsupervised learning in the domain of networking. We provide a comprehensive survey highlighting the recent advancements in unsupervised learning techniques and describe their applications for various learning tasks in the context of networking. We also provide a discussion on future directions and open research issues, while also identifying potential pitfalls. While a few survey papers focusing on the applications of machine learning in networking have previously been published, a survey of similar scope and breadth is missing in literature. Through this paper, we advance the state of knowledge by carefully synthesizing the insights from these survey papers while also providing contemporary coverage of recent advances. △ Less","19 September, 2017",https://arxiv.org/pdf/1709.06599
