title,authors,abstract,submitted_date,pdf_link
Implications of the Fourth Industrial Age on Higher Education,Bo Xing;Tshilidzi Marwala,"Higher education in the fourth industrial revolution, HE 4.0, is a complex, dialectical and exciting opportunity which can potentially transform society for the better. The fourth industrial revolution is powered by artificial intelligence and it will transform the workplace from tasks based characteristics to the human centred characteristics. Because of the convergence of man and machine, it will reduce the subject distance between humanities and social science as well as science and technology. This will necessarily require much more interdisciplinary teaching, research and innovation. This paper explores the impact of HE 4.0 on the mission of a university which is teaching, research (including innovation) and service. △ Less","17 March, 2017",https://arxiv.org/pdf/1703.09643
Efficient Processing of Deep Neural Networks: A Tutorial and Survey,Vivienne Sze;Yu-Hsin Chen;Tien-Ju Yang;Joel Emer,"Deep neural networks (DNNs) are currently widely used for many artificial intelligence (AI) applications including computer vision, speech recognition, and robotics. While DNNs deliver state-of-the-art accuracy on many AI tasks, it comes at the cost of high computational complexity. Accordingly, techniques that enable efficient processing of DNNs to improve energy efficiency and throughput without sacrificing application accuracy or increasing hardware cost are critical to the wide deployment of DNNs in AI systems. This article aims to provide a comprehensive tutorial and survey about the recent advances towards the goal of enabling efficient processing of DNNs. Specifically, it will provide an overview of DNNs, discuss various hardware platforms and architectures that support DNNs, and highlight key trends in reducing the computation cost of DNNs either solely via hardware design changes or via joint hardware design and DNN algorithm changes. It will also summarize various development resources that enable researchers and practitioners to quickly get started in this field, and highlight important benchmarking metrics and design considerations that should be used for evaluating the rapidly growing number of DNN hardware designs, optionally including algorithmic co-designs, being proposed in academia and industry. The reader will take away the following concepts from this article: understand the key design considerations for DNNs; be able to evaluate different DNN hardware implementations with benchmarks and comparison metrics; understand the trade-offs between various hardware architectures and platforms; be able to evaluate the utility of various DNN design techniques for efficient processing; and understand recent implementation trends and opportunities. △ Less","13 August, 2017",https://arxiv.org/pdf/1703.09039
"Balancing Selection Pressures, Multiple Objectives, and Neural Modularity to Coevolve Cooperative Agent Behavior",Alex C. Rollins;Jacob Schrum,"Previous research using evolutionary computation in Multi-Agent Systems indicates that assigning fitness based on team vs.\ individual behavior has a strong impact on the ability of evolved teams of artificial agents to exhibit teamwork in challenging tasks. However, such research only made use of single-objective evolution. In contrast, when a multiobjective evolutionary algorithm is used, populations can be subject to individual-level objectives, team-level objectives, or combinations of the two. This paper explores the performance of cooperatively coevolved teams of agents controlled by artificial neural networks subject to these types of objectives. Specifically, predator agents are evolved to capture scripted prey agents in a torus-shaped grid world. Because of the tension between individual and team behaviors, multiple modes of behavior can be useful, and thus the effect of modular neural networks is also explored. Results demonstrate that fitness rewarding individual behavior is superior to fitness rewarding team behavior, despite being applied to a cooperative task. However, the use of networks with multiple modules allows predators to discover intelligent behavior, regardless of which type of objectives are used. △ Less","24 March, 2017",https://arxiv.org/pdf/1703.08577
Applying Deep Machine Learning for psycho-demographic profiling of Internet users using O.C.E.A.N. model of personality,Iaroslav Omelianenko,"In the modern era, each Internet user leaves enormous amounts of auxiliary digital residuals (footprints) by using a variety of on-line services. All this data is already collected and stored for many years. In recent works, it was demonstrated that it's possible to apply simple machine learning methods to analyze collected digital footprints and to create psycho-demographic profiles of individuals. However, while these works clearly demonstrated the applicability of machine learning methods for such an analysis, created simple prediction models still lacks accuracy necessary to be successfully applied for practical needs. We have assumed that using advanced deep machine learning methods may considerably increase the accuracy of predictions. We started with simple machine learning methods to estimate basic prediction performance and moved further by applying advanced methods based on shallow and deep neural networks. Then we compared prediction power of studied models and made conclusions about its performance. Finally, we made hypotheses how prediction accuracy can be further improved. As result of this work, we provide full source code used in the experiments for all interested researchers and practitioners in corresponding GitHub repository. We believe that applying deep machine learning for psycho-demographic profiling may have an enormous impact on the society (for good or worse) and provides means for Artificial Intelligence (AI) systems to better understand humans by creating their psychological profiles. Thus AI agents may achieve the human-like ability to participate in conversation (communication) flow by anticipating human opponents' reactions, expectations, and behavior. △ Less","5 July, 2017",https://arxiv.org/pdf/1703.06914
I2T2I: Learning Text to Image Synthesis with Textual Data Augmentation,Hao Dong;Jingqing Zhang;Douglas McIlwraith;Yike Guo,"Translating information between text and image is a fundamental problem in artificial intelligence that connects natural language processing and computer vision. In the past few years, performance in image caption generation has seen significant improvement through the adoption of recurrent neural networks (RNN). Meanwhile, text-to-image generation begun to generate plausible images using datasets of specific categories like birds and flowers. We've even seen image generation from multi-category datasets such as the Microsoft Common Objects in Context (MSCOCO) through the use of generative adversarial networks (GANs). Synthesizing objects with a complex shape, however, is still challenging. For example, animals and humans have many degrees of freedom, which means that they can take on many complex shapes. We propose a new training method called Image-Text-Image (I2T2I) which integrates text-to-image and image-to-text (image captioning) synthesis to improve the performance of text-to-image synthesis. We demonstrate that %the capability of our method to understand the sentence descriptions, so as to I2T2I can generate better multi-categories images using MSCOCO than the state-of-the-art. We also demonstrate that I2T2I can achieve transfer learning by using a pre-trained image captioning module to generate human images on the MPII Human Pose △ Less","3 June, 2017",https://arxiv.org/pdf/1703.06676
Artificial Intelligence and Economic Theories,Tshilidzi Marwala;Evan Hurwitz,"The advent of artificial intelligence has changed many disciplines such as engineering, social science and economics. Artificial intelligence is a computational technique which is inspired by natural intelligence such as the swarming of birds, the working of the brain and the pathfinding of the ants. These techniques have impact on economic theories. This book studies the impact of artificial intelligence on economic theories, a subject that has not been extensively studied. The theories that are considered are: demand and supply, asymmetrical information, pricing, rational choice, rational expectation, game theory, efficient market hypotheses, mechanism design, prospect, bounded rationality, portfolio theory, rational counterfactual and causality. The benefit of this book is that it evaluates existing theories of economics and update them based on the developments in artificial intelligence field. △ Less","20 March, 2017",https://arxiv.org/pdf/1703.06597
"Automatically identifying, counting, and describing wild animals in camera-trap images with deep learning",Mohammed Sadegh Norouzzadeh;Anh Nguyen;Margaret Kosmala;Ali Swanson;Meredith Palmer;Craig Packer;Jeff Clune,"Having accurate, detailed, and up-to-date information about the location and behavior of animals in the wild would revolutionize our ability to study and conserve ecosystems. We investigate the ability to automatically, accurately, and inexpensively collect such data, which could transform many fields of biology, ecology, and zoology into ""big data"" sciences. Motion sensor ""camera traps"" enable collecting wildlife pictures inexpensively, unobtrusively, and frequently. However, extracting information from these pictures remains an expensive, time-consuming, manual task. We demonstrate that such information can be automatically extracted by deep learning, a cutting-edge type of artificial intelligence. We train deep convolutional neural networks to identify, count, and describe the behaviors of 48 species in the 3.2-million-image Snapshot Serengeti dataset. Our deep neural networks automatically identify animals with over 93.8% accuracy, and we expect that number to improve rapidly in years to come. More importantly, if our system classifies only images it is confident about, our system can automate animal identification for 99.3% of the data while still performing at the same 96.6% accuracy as that of crowdsourced teams of human volunteers, saving more than 8.4 years (at 40 hours per week) of human labeling effort (i.e. over 17,000 hours) on this 3.2-million-image dataset. Those efficiency gains immediately highlight the importance of using deep neural networks to automate data extraction from camera-trap images. Our results suggest that this technology could enable the inexpensive, unobtrusive, high-volume, and even real-time collection of a wealth of information about vast numbers of animals in the wild. △ Less","15 November, 2017",https://arxiv.org/pdf/1703.05830
Learned Optimizers that Scale and Generalize,Olga Wichrowska;Niru Maheswaranathan;Matthew W. Hoffman;Sergio Gomez Colmenarejo;Misha Denil;Nando de Freitas;Jascha Sohl-Dickstein,"Learning to learn has emerged as an important direction for achieving artificial intelligence. Two of the primary barriers to its adoption are an inability to scale to larger problems and a limited ability to generalize to new tasks. We introduce a learned gradient descent optimizer that generalizes well to new tasks, and which has significantly reduced memory and computation overhead. We achieve this by introducing a novel hierarchical RNN architecture, with minimal per-parameter overhead, augmented with additional architectural features that mirror the known structure of optimization tasks. We also develop a meta-training ensemble of small, diverse optimization tasks capturing common properties of loss landscapes. The optimizer learns to outperform RMSProp/ADAM on problems in this corpus. More importantly, it performs comparably or better when applied to small convolutional neural networks, despite seeing no neural networks in its meta-training set. Finally, it generalizes to train Inception V3 and ResNet V2 architectures on the ImageNet dataset for thousands of steps, optimization problems that are of a vastly different scale than those it was trained on. We release an open source implementation of the meta-training algorithm. △ Less","7 September, 2017",https://arxiv.org/pdf/1703.04813
Continual Learning Through Synaptic Intelligence,Friedemann Zenke;Ben Poole;Surya Ganguli,"While deep learning has led to remarkable advances across diverse applications, it struggles in domains where the data distribution changes over the course of learning. In stark contrast, biological neural networks continually adapt to changing domains, possibly by leveraging complex molecular machinery to solve many tasks simultaneously. In this study, we introduce intelligent synapses that bring some of this biological complexity into artificial neural networks. Each synapse accumulates task relevant information over time, and exploits this information to rapidly store new memories without forgetting old ones. We evaluate our approach on continual learning of classification tasks, and show that it dramatically reduces forgetting while maintaining computational efficiency. △ Less","12 June, 2017",https://arxiv.org/pdf/1703.04200
"BetaRun Soccer Simulation League Team: Variety, Complexity, and Learning",Olivia Michael;Oliver Obst,"RoboCup offers a set of benchmark problems for Artificial Intelligence in form of official world championships since 1997. The most tactical advanced and richest in terms of behavioural complexity of these is the 2D Soccer Simulation League, a simulated robotic soccer competition. BetaRun is a new attempt combining both machine learning and manual programming approaches, with the ultimate goal to arrive at a team that is trained entirely from observing and playing games, and a new development based on agent2D. △ Less","19 August, 2017",https://arxiv.org/pdf/1703.04115
On Quantum Decision Trees,Subhash Kak,Quantum decision systems are being increasingly considered for use in artificial intelligence applications. Classical and quantum nodes can be distinguished based on certain correlations in their states. This paper investigates some properties of the states obtained in a decision tree structure. How these correlations may be mapped to the decision tree is considered. Classical tree representations and approximations to quantum states are provided. △ Less,"8 March, 2017",https://arxiv.org/pdf/1703.03693
Deep Reservoir Computing Using Cellular Automata,Stefano Nichele;Andreas Molund,"Recurrent Neural Networks (RNNs) have been a prominent concept within artificial intelligence. They are inspired by Biological Neural Networks (BNNs) and provide an intuitive and abstract representation of how BNNs work. Derived from the more generic Artificial Neural Networks (ANNs), the recurrent ones are meant to be used for temporal tasks, such as speech recognition, because they are capable of memorizing historic input. However, such networks are very time consuming to train as a result of their inherent nature. Recently, Echo State Networks and Liquid State Machines have been proposed as possible RNN alternatives, under the name of Reservoir Computing (RC). RCs are far more easy to train. In this paper, Cellular Automata are used as reservoir, and are tested on the 5-bit memory task (a well known benchmark within the RC community). The work herein provides a method of mapping binary inputs from the task onto the automata, and a recurrent architecture for handling the sequential aspects of it. Furthermore, a layered (deep) reservoir architecture is proposed. Performances are compared towards earlier work, in addition to its single-layer version. Results show that the single CA reservoir system yields similar results to state-of-the-art work. The system comprised of two layered reservoirs do show a noticeable improvement compared to a single CA reservoir. This indicates potential for further research and provides valuable insight on how to design CA reservoir systems. △ Less","8 March, 2017",https://arxiv.org/pdf/1703.02806
Stochastic Separation Theorems,A. N. Gorban;I. Y. Tyukin,"The problem of non-iterative one-shot and non-destructive correction of unavoidable mistakes arises in all Artificial Intelligence applications in the real world. Its solution requires robust separation of samples with errors from samples where the system works properly. We demonstrate that in (moderately) high dimension this separation could be achieved with probability close to one by linear discriminants. Surprisingly, separation of a new image from a very large set of known images is almost always possible even in moderately high dimensions by linear functionals, and coefficients of these functionals can be found explicitly. Based on fundamental properties of measure concentration, we show that for M<a\exp(b{n}) random M-element sets in \mathbb{R}^n are linearly separable with probability p, p>1-\vartheta, where 1>\vartheta>0 is a given small constant. Exact values of a,b>0 depend on the probability distribution that determines how the random M-element sets are drawn, and on the constant \vartheta. These {\em stochastic separation theorems} provide a new instrument for the development, analysis, and assessment of machine learning methods and algorithms in high dimension. Theoretical statements are illustrated with numerical examples. △ Less","3 August, 2017",https://arxiv.org/pdf/1703.01203
Evaluating Singleplayer and Multiplayer in Human Computation Games,Kristin Siu;Matthew Guzdial;Mark O. Riedl,"Human computation games (HCGs) can provide novel solutions to intractable computational problems, help enable scientific breakthroughs, and provide datasets for artificial intelligence. However, our knowledge about how to design and deploy HCGs that appeal to players and solve problems effectively is incomplete. We present an investigatory HCG based on Super Mario Bros. We used this game in a human subjects study to investigate how different social conditions---singleplayer and multiplayer---and scoring mechanics---collaborative and competitive---affect players' subjective experiences, accuracy at the task, and the completion rate. In doing so, we demonstrate a novel design approach for HCGs, and discuss the benefits and tradeoffs of these mechanics in HCG design. △ Less","2 March, 2017",https://arxiv.org/pdf/1703.00818
Learning A Physical Long-term Predictor,Sebastien Ehrhardt;Aron Monszpart;Niloy J. Mitra;Andrea Vedaldi,"Evolution has resulted in highly developed abilities in many natural intelligences to quickly and accurately predict mechanical phenomena. Humans have successfully developed laws of physics to abstract and model such mechanical phenomena. In the context of artificial intelligence, a recent line of work has focused on estimating physical parameters based on sensory data and use them in physical simulators to make long-term predictions. In contrast, we investigate the effectiveness of a single neural network for end-to-end long-term prediction of mechanical phenomena. Based on extensive evaluation, we demonstrate that such networks can outperform alternate approaches having even access to ground-truth physical simulators, especially when some physical parameters are unobserved or not known a-priori. Further, our network outputs a distribution of outcomes to capture the inherent uncertainty in the data. Our approach demonstrates for the first time the possibility of making actionable long-term predictions from sensor data without requiring to explicitly model the underlying physical laws. △ Less","1 March, 2017",https://arxiv.org/pdf/1703.00247
Don't Fear the Reaper: Refuting Bostrom's Superintelligence Argument,Sebastian Benthall,"In recent years prominent intellectuals have raised ethical concerns about the consequences of artificial intelligence. One concern is that an autonomous agent might modify itself to become ""superintelligent"" and, in supremely effective pursuit of poorly specified goals, destroy all of humanity. This paper considers and rejects the possibility of this outcome. We argue that this scenario depends on an agent's ability to rapidly improve its ability to predict its environment through self-modification. Using a Bayesian model of a reasoning agent, we show that there are important limitations to how an agent may improve its predictive ability through self-modification alone. We conclude that concern about this artificial intelligence outcome is misplaced and better directed at policy questions around data access and storage. △ Less","4 March, 2017",https://arxiv.org/pdf/1702.08495
Criticality & Deep Learning I: Generally Weighted Nets,Dan Oprisa;Peter Toth,"Motivated by the idea that criticality and universality of phase transitions might play a crucial role in achieving and sustaining learning and intelligent behaviour in biological and artificial networks, we analyse a theoretical and a pragmatic experimental set up for critical phenomena in deep learning. On the theoretical side, we use results from statistical physics to carry out critical point calculations in feed-forward/fully connected networks, while on the experimental side we set out to find traces of criticality in deep neural networks. This is our first step in a series of upcoming investigations to map out the relationship between criticality and learning in deep networks. △ Less","31 May, 2017",https://arxiv.org/pdf/1702.08039
Beating the World's Best at Super Smash Bros. with Deep Reinforcement Learning,Vlad Firoiu;William F. Whitney;Joshua B. Tenenbaum,"There has been a recent explosion in the capabilities of game-playing artificial intelligence. Many classes of RL tasks, from Atari games to motor control to board games, are now solvable by fairly generic algorithms, based on deep learning, that learn to play from experience with minimal knowledge of the specific domain of interest. In this work, we will investigate the performance of these methods on Super Smash Bros. Melee (SSBM), a popular console fighting game. The SSBM environment has complex dynamics and partial observability, making it challenging for human and machine alike. The multi-player aspect poses an additional challenge, as the vast majority of recent advances in RL have focused on single-agent environments. Nonetheless, we will show that it is possible to train agents that are competitive against and even surpass human professionals, a new result for the multi-player video game setting. △ Less","8 May, 2017",https://arxiv.org/pdf/1702.06230
Developing a comprehensive framework for multimodal feature extraction,Quinten McNamara;Alejandro de la Vega;Tal Yarkoni,"Feature extraction is a critical component of many applied data science workflows. In recent years, rapid advances in artificial intelligence and machine learning have led to an explosion of feature extraction tools and services that allow data scientists to cheaply and effectively annotate their data along a vast array of dimensions---ranging from detecting faces in images to analyzing the sentiment expressed in coherent text. Unfortunately, the proliferation of powerful feature extraction services has been mirrored by a corresponding expansion in the number of distinct interfaces to feature extraction services. In a world where nearly every new service has its own API, documentation, and/or client library, data scientists who need to combine diverse features obtained from multiple sources are often forced to write and maintain ever more elaborate feature extraction pipelines. To address this challenge, we introduce a new open-source framework for comprehensive multimodal feature extraction. Pliers is an open-source Python package that supports standardized annotation of diverse data types (video, images, audio, and text), and is expressly with both ease-of-use and extensibility in mind. Users can apply a wide range of pre-existing feature extraction tools to their data in just a few lines of Python code, and can also easily add their own custom extractors by writing modular classes. A graph-based API enables rapid development of complex feature extraction pipelines that output results in a single, standardized format. We describe the package's architecture, detail its major advantages over previous feature extraction toolboxes, and use a sample application to a large functional MRI dataset to illustrate how pliers can significantly reduce the time and effort required to construct sophisticated feature extraction workflows while increasing code clarity and maintainability. △ Less","20 February, 2017",https://arxiv.org/pdf/1702.06151
