title,authors,abstract,submitted_date,pdf_link
"Machine Learning, Deepest Learning: Statistical Data Assimilation Problems",Henry Abarbanel;Paul Rozdeba;Sasha Shirman,"We formulate a strong equivalence between machine learning, artificial intelligence methods and the formulation of statistical data assimilation as used widely in physical and biological sciences. The correspondence is that layer number in the artificial network setting is the analog of time in the data assimilation setting. Within the discussion of this equivalence we show that adding more layers (making the network deeper) is analogous to adding temporal resolution in a data assimilation framework. How one can find a candidate for the global minimum of the cost functions in the machine learning context using a method from data assimilation is discussed. Calculations on simple models from each side of the equivalence are reported. Also discussed is a framework in which the time or layer label is taken to be continuous, providing a differential equation, the Euler-Lagrange equation, which shows that the problem being solved is a two point boundary value problem familiar in the discussion of variational methods. The use of continuous layers is denoted ""deepest learning"". These problems respect a symplectic symmetry in continuous time/layer phase space. Both Lagrangian versions and Hamiltonian versions of these problems are presented. Their well-studied implementation in a discrete time/layer, while respected the symplectic structure, is addressed. The Hamiltonian version provides a direct rationale for back propagation as a solution method for the canonical momentum. △ Less","5 July, 2017",https://arxiv.org/pdf/1707.01415
OPEB: Open Physical Environment Benchmark for Artificial Intelligence,Hamid Mirzaei;Mona Fathollahi;Tony Givargis,"Artificial Intelligence methods to solve continuous- control tasks have made significant progress in recent years. However, these algorithms have important limitations and still need significant improvement to be used in industry and real- world applications. This means that this area is still in an active research phase. To involve a large number of research groups, standard benchmarks are needed to evaluate and compare proposed algorithms. In this paper, we propose a physical environment benchmark framework to facilitate collaborative research in this area by enabling different research groups to integrate their designed benchmarks in a unified cloud-based repository and also share their actual implemented benchmarks via the cloud. We demonstrate the proposed framework using an actual implementation of the classical mountain-car example and present the results obtained using a Reinforcement Learning algorithm. △ Less","3 July, 2017",https://arxiv.org/pdf/1707.00790
Modeling preference time in middle distance triathlons,Iztok Fister;Andres Iglesias;Suash Deb;Dušan Fister;Iztok Fister Jr,"Modeling preference time in triathlons means predicting the intermediate times of particular sports disciplines by a given overall finish time in a specific triathlon course for the athlete with the known personal best result. This is a hard task for athletes and sport trainers due to a lot of different factors that need to be taken into account, e.g., athlete's abilities, health, mental preparations and even their current sports form. So far, this process was calculated manually without any specific software tools or using the artificial intelligence. This paper presents the new solution for modeling preference time in middle distance triathlons based on particle swarm optimization algorithm and archive of existing sports results. Initial results are presented, which suggest the usefulness of proposed approach, while remarks for future improvements and use are also emphasized. △ Less","3 July, 2017",https://arxiv.org/pdf/1707.00718
The Relationship Between Emotion Models and Artificial Intelligence,Christoph Bartneck;Michael J. Lyons;Martin Saerbeck,"Emotions play a central role in most forms of natural human interaction so we may expect that computational methods for the processing and expression of emotions will play a growing role in human-computer interaction. The OCC model has established itself as the standard model for emotion synthesis. A large number of studies employed the OCC model to generate emotions for their embodied characters. Many developers of such characters believe that the OCC model will be all they ever need to equip their character with emotions. This study reflects on the limitations of the OCC model specifically, and on the emotion models in general due to their dependency on artificial intelligence. △ Less","28 June, 2017",https://arxiv.org/pdf/1706.09554
Auto-Encoding User Ratings via Knowledge Graphs in Recommendation Scenarios,Vito Bellini;Vito Walter Anelli;Tommaso Di Noia;Eugenio Di Sciascio,"In the last decade, driven also by the availability of an unprecedented computational power and storage capabilities in cloud environments we assisted to the proliferation of new algorithms, methods, and approaches in two areas of artificial intelligence: knowledge representation and machine learning. On the one side, the generation of a high rate of structured data on the Web led to the creation and publication of the so-called knowledge graphs. On the other side, deep learning emerged as one of the most promising approaches in the generation and training of models that can be applied to a wide variety of application fields. More recently, autoencoders have proven their strength in various scenarios, playing a fundamental role in unsupervised learning. In this paper, we instigate how to exploit the semantic information encoded in a knowledge graph to build connections between units in a Neural Network, thus leading to a new method, SEM-AUTO, to extract and weigh semantic features that can eventually be used to build a recommender system. As adding content-based side information may mitigate the cold user problems, we tested how our approach behave in the presence of a few rating from a user on the Movielens 1M dataset and compare results with BPRSLIM. △ Less","24 July, 2017",https://arxiv.org/pdf/1706.07956
Preserving Intermediate Objectives: One Simple Trick to Improve Learning for Hierarchical Models,Abhilasha Ravichander;Shruti Rijhwani;Rajat Kulshreshtha;Chirag Nagpal;Tadas Baltrušaitis;Louis-Philippe Morency,"Hierarchical models are utilized in a wide variety of problems which are characterized by task hierarchies, where predictions on smaller subtasks are useful for trying to predict a final task. Typically, neural networks are first trained for the subtasks, and the predictions of these networks are subsequently used as additional features when training a model and doing inference for a final task. In this work, we focus on improving learning for such hierarchical models and demonstrate our method on the task of speaker trait prediction. Speaker trait prediction aims to computationally identify which personality traits a speaker might be perceived to have, and has been of great interest to both the Artificial Intelligence and Social Science communities. Persuasiveness prediction in particular has been of interest, as persuasive speakers have a large amount of influence on our thoughts, opinions and beliefs. In this work, we examine how leveraging the relationship between related speaker traits in a hierarchical structure can help improve our ability to predict how persuasive a speaker is. We present a novel algorithm that allows us to backpropagate through this hierarchy. This hierarchical model achieves a 25% relative error reduction in classification accuracy over current state-of-the art methods on the publicly available POM dataset. △ Less","23 June, 2017",https://arxiv.org/pdf/1706.07867
A Useful Motif for Flexible Task Learning in an Embodied Two-Dimensional Visual Environment,Kevin T. Feigelis;Daniel L. K. Yamins,"Animals (especially humans) have an amazing ability to learn new tasks quickly, and switch between them flexibly. How brains support this ability is largely unknown, both neuroscientifically and algorithmically. One reasonable supposition is that modules drawing on an underlying general-purpose sensory representation are dynamically allocated on a per-task basis. Recent results from neuroscience and artificial intelligence suggest the role of the general purpose visual representation may be played by a deep convolutional neural network, and give some clues how task modules based on such a representation might be discovered and constructed. In this work, we investigate module architectures in an embodied two-dimensional touchscreen environment, in which an agent's learning must occur via interactions with an environment that emits images and rewards, and accepts touches as input. This environment is designed to capture the physical structure of the task environments that are commonly deployed in visual neuroscience and psychophysics. We show that in this context, very simple changes in the nonlinear activations used by such a module can significantly influence how fast it is at learning visual tasks and how suitable it is for switching to new tasks. △ Less","21 June, 2017",https://arxiv.org/pdf/1706.07147
Expert and Non-Expert Opinion about Technological Unemployment,Toby Walsh,"There is significant concern that technological advances, especially in Robotics and Artificial Intelligence (AI), could lead to high levels of unemployment in the coming decades. Studies have estimated that around half of all current jobs are at risk of automation. To look into this issue in more depth, we surveyed experts in Robotics and AI about the risk, and compared their views with those of non-experts. Whilst the experts predicted a significant number of occupations were at risk of automation in the next two decades, they were more cautious than people outside the field in predicting occupations at risk. Their predictions were consistent with their estimates for when computers might be expected to reach human level performance across a wide range of skills. These estimates were typically decades later than those of the non-experts. Technological barriers may therefore provide society with more time to prepare for an automated future than the public fear. In addition, public expectations may need to be dampened about the speed of progress to be expected in Robotics and AI. △ Less","21 June, 2017",https://arxiv.org/pdf/1706.06906
Grounded Language Learning in a Simulated 3D World,Karl Moritz Hermann;Felix Hill;Simon Green;Fumin Wang;Ryan Faulkner;Hubert Soyer;David Szepesvari;Wojciech Marian Czarnecki;Max Jaderberg;Denis Teplyashin;Marcus Wainwright;Chris Apps;Demis Hassabis;Phil Blunsom,"We are increasingly surrounded by artificially intelligent technology that takes decisions and executes actions on our behalf. This creates a pressing need for general means to communicate with, instruct and guide artificial agents, with human language the most compelling means for such communication. To achieve this in a scalable fashion, agents must be able to relate language to the world and to actions; that is, their understanding of language must be grounded and embodied. However, learning grounded language is a notoriously challenging problem in artificial intelligence research. Here we present an agent that learns to interpret language in a simulated 3D environment where it is rewarded for the successful execution of written instructions. Trained via a combination of reinforcement and unsupervised learning, and beginning with minimal prior knowledge, the agent learns to relate linguistic symbols to emergent perceptual representations of its physical surroundings and to pertinent sequences of actions. The agent's comprehension of language extends beyond its prior experience, enabling it to apply familiar language to unfamiliar situations and to interpret entirely novel instructions. Moreover, the speed with which this agent learns new words increases as its semantic knowledge grows. This facility for generalising and bootstrapping semantic knowledge indicates the potential of the present approach for reconciling ambiguous natural language with the complexity of the physical world. △ Less","26 June, 2017",https://arxiv.org/pdf/1706.06551
Structured Best Arm Identification with Fixed Confidence,Ruitong Huang;Mohammad M. Ajallooeian;Csaba Szepesvári;Martin Müller,"We study the problem of identifying the best action among a set of possible options when the value of each action is given by a mapping from a number of noisy micro-observables in the so-called fixed confidence setting. Our main motivation is the application to the minimax game search, which has been a major topic of interest in artificial intelligence. In this paper we introduce an abstract setting to clearly describe the essential properties of the problem. While previous work only considered a two-move game tree search problem, our abstract setting can be applied to the general minimax games where the depth can be non-uniform and arbitrary, and transpositions are allowed. We introduce a new algorithm (LUCB-micro) for the abstract setting, and give its lower and upper sample complexity results. Our bounds recover some previous results, which were only available in more limited settings, while they also shed further light on how the structure of minimax problems influence sample complexity. △ Less","19 June, 2017",https://arxiv.org/pdf/1706.05198
Improving Scalability of Inductive Logic Programming via Pruning and Best-Effort Optimisation,Mishal Kazmi;Peter Schüller;Yücel Saygın,"Inductive Logic Programming (ILP) combines rule-based and statistical artificial intelligence methods, by learning a hypothesis comprising a set of rules given background knowledge and constraints for the search space. We focus on extending the XHAIL algorithm for ILP which is based on Answer Set Programming and we evaluate our extensions using the Natural Language Processing application of sentence chunking. With respect to processing natural language, ILP can cater for the constant change in how we use language on a daily basis. At the same time, ILP does not require huge amounts of training examples such as other statistical methods and produces interpretable results, that means a set of rules, which can be analysed and tweaked if necessary. As contributions we extend XHAIL with (i) a pruning mechanism within the hypothesis generalisation algorithm which enables learning from larger datasets, (ii) a better usage of modern solver technology using recently developed optimisation methods, and (iii) a time budget that permits the usage of suboptimal results. We evaluate these improvements on the task of sentence chunking using three datasets from a recent SemEval competition. Results show that our improvements allow for learning on bigger datasets with results that are of similar quality to state-of-the-art systems on the same task. Moreover, we compare the hypotheses obtained on datasets to gain insights on the structure of each dataset. △ Less","16 June, 2017",https://arxiv.org/pdf/1706.05171
AI-Powered Social Bots,Terrence Adams,"This paper gives an overview of impersonation bots that generate output in one, or possibly, multiple modalities. We also discuss rapidly advancing areas of machine learning and artificial intelligence that could lead to frighteningly powerful new multi-modal social bots. Our main conclusion is that most commonly known bots are one dimensional (i.e., chatterbot), and far from deceiving serious interrogators. However, using recent advances in machine learning, it is possible to unleash incredibly powerful, human-like armies of social bots, in potentially well coordinated campaigns of deception and influence. △ Less","16 June, 2017",https://arxiv.org/pdf/1706.05143
A New Probabilistic Algorithm for Approximate Model Counting,Cunjing Ge;Feifei Ma;Tian Liu;Jian Zhang,"Constrained counting is important in domains ranging from artificial intelligence to software analysis. There are already a few approaches for counting models over various types of constraints. Recently, hashing-based approaches achieve both theoretical guarantees and scalability, but still rely on solution enumeration. In this paper, a new probabilistic polynomial time approximate model counter is proposed, which is also a hashing-based universal framework, but with only satisfiability queries. A variant with a dynamic stopping criterion is also presented. Empirical evaluation over benchmarks on propositional logic formulas and SMT(BV) formulas shows that the approach is promising. △ Less","13 June, 2017",https://arxiv.org/pdf/1706.03906
Decoupling Learning Rules from Representations,Philip S. Thomas;Christoph Dann;Emma Brunskill,"In the artificial intelligence field, learning often corresponds to changing the parameters of a parameterized function. A learning rule is an algorithm or mathematical expression that specifies precisely how the parameters should be changed. When creating an artificial intelligence system, we must make two decisions: what representation should be used (i.e., what parameterized function should be used) and what learning rule should be used to search through the resulting set of representable functions. Using most learning rules, these two decisions are coupled in a subtle (and often unintentional) way. That is, using the same learning rule with two different representations that can represent the same sets of functions can result in two different outcomes. After arguing that this coupling is undesirable, particularly when using artificial neural networks, we present a method for partially decoupling these two decisions for a broad class of learning rules that span unsupervised learning, reinforcement learning, and supervised learning. △ Less","9 June, 2017",https://arxiv.org/pdf/1706.03100
Ethical Artificial Intelligence - An Open Question,Alice Pavaloiu;Utku Kose,"Artificial Intelligence (AI) is an effective science which employs strong enough approaches, methods, and techniques to solve unsolvable real world based problems. Because of its unstoppable rise towards the future, there are also some discussions about its ethics and safety. Shaping an AI friendly environment for people and a people friendly environment for AI can be a possible answer for finding a shared context of values for both humans and robots. In this context, objective of this paper is to address the ethical issues of AI and explore the moral dilemmas that arise from ethical algorithms, from pre set or acquired values. In addition, the paper will also focus on the subject of AI safety. As general, the paper will briefly analyze the concerns and potential solutions to solving the ethical issues presented and increase readers awareness on AI safety as another related research interest. △ Less","16 May, 2017",https://arxiv.org/pdf/1706.03021
A Tutor Agent for MOBA Games,Victor do Nascimento Silva;Luiz Chaimowicz,"Digital games have become a key player in the entertainment industry, attracting millions of new players each year. In spite of that, novice players may have a hard time when playing certain types of games, such as MOBAs and MMORPGs, due to their steep learning curves and not so friendly online communities. In this paper, we present an approach to help novice players in MOBA games overcome these problems. An artificial intelligence agent plays alongside the player analyzing his/her performance and giving tips about the game. Experiments performed with the game {\em League of Legends} show the potential of this approach. △ Less","9 June, 2017",https://arxiv.org/pdf/1706.02832
Dynamic Difficulty Adjustment on MOBA Games,Mirna Paula Silva;Victor do Nascimento Silva;Luiz Chaimowicz,"This paper addresses the dynamic difficulty adjustment on MOBA games as a way to improve the player's entertainment. Although MOBA is currently one of the most played genres around the world, it is known as a game that offer less autonomy, more challenges and consequently more frustration. Due to these characteristics, the use of a mechanism that performs the difficulty balance dynamically seems to be an interesting alternative to minimize and/or avoid that players experience such frustrations. In this sense, this paper presents a dynamic difficulty adjustment mechanism for MOBA games. The main idea is to create a computer controlled opponent that adapts dynamically to the player performance, trying to offer to the player a better game experience. This is done by evaluating the performance of the player using a metric based on some game features and switching the difficulty of the opponent's artificial intelligence behavior accordingly. Quantitative and qualitative experiments were performed and the results showed that the system is capable of adapting dynamically to the opponent's skills. In spite of that, the qualitative experiments with users showed that the player's expertise has a greater influence on the perception of the difficulty level and dynamic adaptation. △ Less","8 June, 2017",https://arxiv.org/pdf/1706.02796
Rapid Randomized Restarts for Multi-Agent Path Finding Solvers,Liron Cohen;Glenn Wagner;T. K. Satish Kumar;Howie Choset;Sven Koenig,"Multi-Agent Path Finding (MAPF) is an NP-hard problem well studied in artificial intelligence and robotics. It has many real-world applications for which existing MAPF solvers use various heuristics. However, these solvers are deterministic and perform poorly on ""hard"" instances typically characterized by many agents interfering with each other in a small region. In this paper, we enhance MAPF solvers with randomization and observe that they exhibit heavy-tailed distributions of runtimes on hard instances. This leads us to develop simple rapid randomized restart (RRR) strategies with the intuition that, given a hard instance, multiple short runs have a better chance of solving it compared to one long run. We validate this intuition through experiments and show that our RRR strategies indeed boost the performance of state-of-the-art MAPF solvers such as iECBS and M*. △ Less","8 June, 2017",https://arxiv.org/pdf/1706.02794
Responsible Autonomy,Virginia Dignum,"As intelligent systems are increasingly making decisions that directly affect society, perhaps the most important upcoming research direction in AI is to rethink the ethical implications of their actions. Means are needed to integrate moral, societal and legal values with technological developments in AI, both during the design process as well as part of the deliberation algorithms employed by these systems. In this paper, we describe leading ethics theories and propose alternative ways to ensure ethical behavior by artificial systems. Given that ethics are dependent on the socio-cultural context and are often only implicit in deliberation processes, methodologies are needed to elicit the values held by designers and stakeholders, and to make these explicit leading to better understanding and trust on artificial autonomous systems. △ Less","8 June, 2017",https://arxiv.org/pdf/1706.02513
Learning to Represent Mechanics via Long-term Extrapolation and Interpolation,Sébastien Ehrhardt;Aron Monszpart;Andrea Vedaldi;Niloy Mitra,"While the basic laws of Newtonian mechanics are well understood, explaining a physical scenario still requires manually modeling the problem with suitable equations and associated parameters. In order to adopt such models for artificial intelligence, researchers have handcrafted the relevant states, and then used neural networks to learn the state transitions using simulation runs as training data. Unfortunately, such approaches can be unsuitable for modeling complex real-world scenarios, where manually authoring relevant state spaces tend to be challenging. In this work, we investigate if neural networks can implicitly learn physical states of real-world mechanical processes only based on visual data, and thus enable long-term physical extrapolation. We develop a recurrent neural network architecture for this task and also characterize resultant uncertainties in the form of evolving variance estimates. We evaluate our setup to extrapolate motion of a rolling ball on bowl of varying shape and orientation using only images as input, and report competitive results with approaches that assume access to internal physics models and parameters. △ Less","8 June, 2017",https://arxiv.org/pdf/1706.02179
