title,authors,abstract,submitted_date,pdf_link
Principles of Neuromorphic Photonics,Bhavin J. Shastri;Alexander N. Tait;Thomas Ferreira de Lima;Mitchell A. Nahmias;Hsuan-Tung Peng;Paul R. Prucnal,"In an age overrun with information, the ability to process reams of data has become crucial. The demand for data will continue to grow as smart gadgets multiply and become increasingly integrated into our daily lives. Next-generation industries in artificial intelligence services and high-performance computing are so far supported by microelectronic platforms. These data-intensive enterprises rely on continual improvements in hardware. Their prospects are running up against a stark reality: conventional one-size-fits-all solutions offered by digital electronics can no longer satisfy this need, as Moore's law (exponential hardware scaling), interconnection density, and the von Neumann architecture reach their limits. With its superior speed and reconfigurability, analog photonics can provide some relief to these problems; however, complex applications of analog photonics have remained largely unexplored due to the absence of a robust photonic integration industry. Recently, the landscape for commercially-manufacturable photonic chips has been changing rapidly and now promises to achieve economies of scale previously enjoyed solely by microelectronics. The scientific community has set out to build bridges between the domains of photonic device physics and neural networks, giving rise to the field of \emph{neuromorphic photonics}. This article reviews the recent progress in integrated neuromorphic photonics. We provide an overview of neuromorphic computing, discuss the associated technology (microelectronic and photonic) platforms and compare their metric performance. We discuss photonic neural network approaches and challenges for integrated neuromorphic photonic processors while providing an in-depth description of photonic neurons and a candidate interconnection architecture. We conclude with a future outlook of neuro-inspired photonic processing. △ Less","29 December, 2017",https://arxiv.org/pdf/1801.00016
What do we need to build explainable AI systems for the medical domain?,Andreas Holzinger;Chris Biemann;Constantinos S. Pattichis;Douglas B. Kell,"Artificial intelligence (AI) generally and machine learning (ML) specifically demonstrate impressive practical success in many different application domains, e.g. in autonomous driving, speech recognition, or recommender systems. Deep learning approaches, trained on extremely large data sets or using reinforcement learning methods have even exceeded human performance in visual tasks, particularly on playing games such as Atari, or mastering the game of Go. Even in the medical domain there are remarkable results. The central problem of such models is that they are regarded as black-box models and even if we understand the underlying mathematical principles, they lack an explicit declarative knowledge representation, hence have difficulty in generating the underlying explanatory structures. This calls for systems enabling to make decisions transparent, understandable and explainable. A huge motivation for our approach are rising legal and privacy aspects. The new European General Data Protection Regulation entering into force on May 25th 2018, will make black-box approaches difficult to use in business. This does not imply a ban on automatic learning approaches or an obligation to explain everything all the time, however, there must be a possibility to make the results re-traceable on demand. In this paper we outline some of our research topics in the context of the relatively new area of explainable-AI with a focus on the application in medicine, which is a very special domain. This is due to the fact that medical professionals are working mostly with distributed heterogeneous and complex sources of data. In this paper we concentrate on three sources: images, *omics data and text. We argue that research in explainable-AI would generally help to facilitate the implementation of AI/ML in the medical domain, and specifically help to facilitate transparency and trust. △ Less","28 December, 2017",https://arxiv.org/pdf/1712.09923
An empirical evaluation for the intrusion detection features based on machine learning and feature selection methods,Mouhammd Alkasassbeh,"Despite the great developments in information technology, particularly the Internet, computer networks, global information exchange, and its positive impact in all areas of daily life, it has also contributed to the development of penetration and intrusion which forms a high risk to the security of information organizations, government agencies, and causes large economic losses. There are many techniques designed for protection such as firewall and intrusion detection systems (IDS). IDS is a set of software and/or hardware techniques used to detect hacker's activities in computer systems. Two types of anomalies are used in IDS to detect intrusive activities different from normal user behavior. Misuse relies on the knowledge base that contains all known attack techniques and intrusion is discovered through research in this knowledge base. Artificial intelligence techniques have been introduced to improve the performance of these systems. The importance of IDS is to identify unauthorized access attempting to compromise confidentiality, integrity or availability of the computer network. This paper investigates the Intrusion Detection (ID) problem using three machine learning algorithms namely, BayesNet algorithm, Multi-Layer Perceptron (MLP), and Support Vector Machine (SVM). The algorithms are applied on a real, Management Information Based (MIB) dataset that is collected from real life environment. To enhance the detection process accuracy, a set of feature selection approaches is used; Infogain (IG), ReleifF (RF), and Genetic Search (GS). Our experiments show that the three feature selection methods have enhanced the classification performance. GS with bayesNet, MLP and SVM give high accuracy rates, more specifically the BayesNet with the GS accuracy rate is 99.9%. △ Less","27 December, 2017",https://arxiv.org/pdf/1712.09623
Null Dynamical State Models of Human Cognitive Dysfunction,M. J. Gagen,"The hard problem in artificial intelligence asks how the shuffling of syntactical symbols in a program can lead to systems which experience semantics and qualia. We address this question in three stages. First, we introduce a new class of human semantic symbols which appears when unexpected and drastic environmental change causes humans to become surprised, confused, uncertain, and in extreme cases, unresponsive, passive and dysfunctional. For this class of symbols, pre-learned programs become inoperative so these syntactical programs cannot be the source of experienced qualia. Second, we model the dysfunctional human response to a radically changed environment as being the natural response of any learning machine facing novel inputs from well outside its previous training set. In this situation, learning machines are unable to extract information from their input and will typically enter a dynamical state characterized by null outputs and a lack of response. This state immediately predicts and explains the characteristics of the semantic experiences of humans in similar circumstances. In the third stage, we consider learning machines trained to implement multiple functions in simple sequential programs using environmental data to specify subroutine names, control flow instructions, memory calls, and so on. Drastic change in any of these environmental inputs can again lead to inoperative programs. By examining changes specific to people or locations we can model human cognitive symbols featuring these dependencies, such as attachment and grief. Our approach links known dynamical machines states with human qualia and thus offers new insight into the hard problem of artificial intelligence. △ Less","25 December, 2017",https://arxiv.org/pdf/1712.09014
An Ensemble Model with Ranking for Social Dialogue,Ioannis Papaioannou;Amanda Cercas Curry;Jose L. Part;Igor Shalyminov;Xinnuo Xu;Yanchao Yu;Ondřej Dušek;Verena Rieser;Oliver Lemon,"Open-domain social dialogue is one of the long-standing goals of Artificial Intelligence. This year, the Amazon Alexa Prize challenge was announced for the first time, where real customers get to rate systems developed by leading universities worldwide. The aim of the challenge is to converse ""coherently and engagingly with humans on popular topics for 20 minutes"". We describe our Alexa Prize system (called 'Alana') consisting of an ensemble of bots, combining rule-based and machine learning systems, and using a contextual ranking mechanism to choose a system response. The ranker was trained on real user feedback received during the competition, where we address the problem of how to train on the noisy and sparse feedback obtained during the competition. △ Less","20 December, 2017",https://arxiv.org/pdf/1712.07558
Partial Labeled Gastric Tumor Segmentation via patch-based Reiterative Learning,Yang Nan;Gianmarc Coppola;Qiaokang Liang;Kunglin Zou;Wei Sun;Dan Zhang;Yaonan Wang;Guanzhen Yu,"Gastric cancer is the second leading cause of cancer-related deaths worldwide, and the major hurdle in biomedical image analysis is the determination of the cancer extent. This assignment has high clinical relevance and would generally require vast microscopic assessment by pathologists. Recent advances in deep learning have produced inspiring results on biomedical image segmentation, while its outcome is reliant on comprehensive annotation. This requires plenty of labor costs, for the ground truth must be annotated meticulously by pathologists. In this paper, a reiterative learning framework was presented to train our network on partial annotated biomedical images, and superior performance was achieved without any pre-trained or further manual annotation. We eliminate the boundary error of patch-based model through our overlapped region forecast algorithm. Through these advisable methods, a mean intersection over union coefficient (IOU) of 0.883 and mean accuracy of 91.09% on the partial labeled dataset was achieved, which made us win the 2017 China Big Data & Artificial Intelligence Innovation and Entrepreneurship Competitions. △ Less","20 December, 2017",https://arxiv.org/pdf/1712.07488
Revisiting the Master-Slave Architecture in Multi-Agent Deep Reinforcement Learning,Xiangyu Kong;Bo Xin;Fangchen Liu;Yizhou Wang,"Many tasks in artificial intelligence require the collaboration of multiple agents. We exam deep reinforcement learning for multi-agent domains. Recent research efforts often take the form of two seemingly conflicting perspectives, the decentralized perspective, where each agent is supposed to have its own controller; and the centralized perspective, where one assumes there is a larger model controlling all agents. In this regard, we revisit the idea of the master-slave architecture by incorporating both perspectives within one framework. Such a hierarchical structure naturally leverages advantages from one another. The idea of combining both perspectives is intuitive and can be well motivated from many real world systems, however, out of a variety of possible realizations, we highlights three key ingredients, i.e. composed action representation, learnable communication and independent reasoning. With network designs to facilitate these explicitly, our proposal consistently outperforms latest competing methods both in synthetic experiments and when applied to challenging StarCraft micromanagement tasks. △ Less","19 December, 2017",https://arxiv.org/pdf/1712.07305
Cognitive Database: A Step towards Endowing Relational Databases with Artificial Intelligence Capabilities,Rajesh Bordawekar;Bortik Bandyopadhyay;Oded Shmueli,"We propose Cognitive Databases, an approach for transparently enabling Artificial Intelligence (AI) capabilities in relational databases. A novel aspect of our design is to first view the structured data source as meaningful unstructured text, and then use the text to build an unsupervised neural network model using a Natural Language Processing (NLP) technique called word embedding. This model captures the hidden inter-/intra-column relationships between database tokens of different types. For each database token, the model includes a vector that encodes contextual semantic relationships. We seamlessly integrate the word embedding model into existing SQL query infrastructure and use it to enable a new class of SQL-based analytics queries called cognitive intelligence (CI) queries. CI queries use the model vectors to enable complex queries such as semantic matching, inductive reasoning queries such as analogies, predictive queries using entities not present in a database, and, more generally, using knowledge from external sources. We demonstrate unique capabilities of Cognitive Databases using an Apache Spark based prototype to execute inductive reasoning CI queries over a multi-modal database containing text and images. We believe our first-of-a-kind system exemplifies using AI functionality to endow relational databases with capabilities that were previously very hard to realize in practice. △ Less","19 December, 2017",https://arxiv.org/pdf/1712.07199
Large-Scale Vandalism Detection with Linear Classifiers - The Conkerberry Vandalism Detector at WSDM Cup 2017,Alexey Grigorev,"Nowadays many artificial intelligence systems rely on knowledge bases for enriching the information they process. Such Knowledge Bases are usually difficult to obtain and therefore they are crowdsourced: they are available for everyone on the internet to suggest edits and add new information. Unfortunately, they are sometimes targeted by vandals who put inaccurate or offensive information there. This is especially bad for the systems that use these Knowledge Bases: for them it is important to use reliable information to make correct inferences. One of such knowledge bases is Wikidata, and to fight vandals the organizers of WSDM Cup 2017 challenged participants to build a model for detecting mistrustful edits. In this paper we present the second place solution to the cup: we show that it is possible to achieve competitive performance with simple linear classification. With our approach we can achieve AU ROC of 0.938 on the test data. Additionally, compared to other approaches, ours is significantly faster. The solution is made available on GitHub. △ Less","19 December, 2017",https://arxiv.org/pdf/1712.06920
Towards the Augmented Pathologist: Challenges of Explainable-AI in Digital Pathology,Andreas Holzinger;Bernd Malle;Peter Kieseberg;Peter M. Roth;Heimo Müller;Robert Reihs;Kurt Zatloukal,"Digital pathology is not only one of the most promising fields of diagnostic medicine, but at the same time a hot topic for fundamental research. Digital pathology is not just the transfer of histopathological slides into digital representations. The combination of different data sources (images, patient records, and *omics data) together with current advances in artificial intelligence/machine learning enable to make novel information accessible and quantifiable to a human expert, which is not yet available and not exploited in current medical settings. The grand goal is to reach a level of usable intelligence to understand the data in the context of an application task, thereby making machine decisions transparent, interpretable and explainable. The foundation of such an ""augmented pathologist"" needs an integrated approach: While machine learning algorithms require many thousands of training examples, a human expert is often confronted with only a few data points. Interestingly, humans can learn from such few examples and are able to instantly interpret complex patterns. Consequently, the grand goal is to combine the possibilities of artificial intelligence with human intelligence and to find a well-suited balance between them to enable what neither of them could do on their own. This can raise the quality of education, diagnosis, prognosis and prediction of cancer and other diseases. In this paper we describe some (incomplete) research issues which we believe should be addressed in an integrated and concerted effort for paving the way towards the augmented pathologist. △ Less","18 December, 2017",https://arxiv.org/pdf/1712.06657
Three IQs of AI Systems and their Testing Methods,Feng Liu;Yong Shi;Ying Liu,"The rapid development of artificial intelligence has brought the artificial intelligence threat theory as well as the problem about how to evaluate the intelligence level of intelligent products. Both need to find a quantitative method to evaluate the intelligence level of intelligence systems, including human intelligence. Based on the standard intelligence system and the extended Von Neumann architecture, this paper proposes General IQ, Service IQ and Value IQ evaluation methods for intelligence systems, depending on different evaluation purposes. Among them, the General IQ of intelligence systems is to answer the question of whether the artificial intelligence can surpass the human intelligence, which is reflected in putting the intelligence systems on an equal status and conducting the unified evaluation. The Service IQ and Value IQ of intelligence systems are used to answer the question of how the intelligent products can better serve the human, reflecting the intelligence and required cost of each intelligence system as a product in the process of serving human. △ Less","14 December, 2017",https://arxiv.org/pdf/1712.06440
Deep Learning for Distant Speech Recognition,Mirco Ravanelli,"Deep learning is an emerging technology that is considered one of the most promising directions for reaching higher levels of artificial intelligence. Among the other achievements, building computers that understand speech represents a crucial leap towards intelligent machines. Despite the great efforts of the past decades, however, a natural and robust human-machine speech interaction still appears to be out of reach, especially when users interact with a distant microphone in noisy and reverberant environments. The latter disturbances severely hamper the intelligibility of a speech signal, making Distant Speech Recognition (DSR) one of the major open challenges in the field. This thesis addresses the latter scenario and proposes some novel techniques, architectures, and algorithms to improve the robustness of distant-talking acoustic models. We first elaborate on methodologies for realistic data contamination, with a particular emphasis on DNN training with simulated data. We then investigate on approaches for better exploiting speech contexts, proposing some original methodologies for both feed-forward and recurrent neural networks. Lastly, inspired by the idea that cooperation across different DNNs could be the key for counteracting the harmful effects of noise and reverberation, we propose a novel deep learning paradigm called network of deep neural networks. The analysis of the original concepts were based on extensive experimental validations conducted on both real and simulated data, considering different corpora, microphone configurations, environments, noisy conditions, and ASR tasks. △ Less","17 December, 2017",https://arxiv.org/pdf/1712.06086
Using Machine Learning to Enhance Vehicles Traffic in ATN (PRT) Systems,Bogdan Czejdo;Wiktor B. Daszczuk;Mikołaj Baszun,"This paper discusses new techniques to enhance Automated Transit Networks (ATN, previously called Personal Rapid Transit - PRT) based on Artificial Intelligence tools. The main direction is improvement of the cooperation of autonomous modules that use negotiation protocols, following the IoT paradigm. One of the goals is to increase ATN system throughput by tuning up autonomous vehicles cooperation. Machine learning (ML) was used to improve algorithms designed by human programmers. We used ""existing controls"" corresponding to near-optimal solutions and built refinement models to more accurately relate a system's dynamics to its performance. A mechanism that mostly influences ATN performance is Empty Vehicle Management (EVM). The algorithms designed by human programmers was used: calls to empty vehicles for waiting passengers and balancing based on reallocation of empty vehicles to achieve better regularity of their settlement. In this paper we discuss how we can improve these algorithms (and tune them to current conditions) by using ML to tailor individual behavioral policies. Using ML techniques was possible because our algorithm is based on a set of parameters. A number of weights and thresholds could be tuned up to give better decisions on moving empty vehicles across the track. △ Less","16 December, 2017",https://arxiv.org/pdf/1712.05990
An Artificial Neural Network Architecture Based on Context Transformations in Cortical Minicolumns,Vasily Morzhakov;Alexey Redozubov,"Cortical minicolumns are considered a model of cortical organization. Their function is still a source of research and not reflected properly in modern architecture of nets in algorithms of Artificial Intelligence. We assume its function and describe it in this article. Furthermore, we show how this proposal allows to construct a new architecture, that is not based on convolutional neural networks, test it on MNIST data and receive close to Convolutional Neural Network accuracy. We also show that the proposed architecture possesses an ability to train on a small quantity of samples. To achieve these results, we enable the minicolumns to remember context transformations. △ Less","16 December, 2017",https://arxiv.org/pdf/1712.05954
A Berkeley View of Systems Challenges for AI,Ion Stoica;Dawn Song;Raluca Ada Popa;David Patterson;Michael W. Mahoney;Randy Katz;Anthony D. Joseph;Michael Jordan;Joseph M. Hellerstein;Joseph E. Gonzalez;Ken Goldberg;Ali Ghodsi;David Culler;Pieter Abbeel,"With the increasing commoditization of computer vision, speech recognition and machine translation systems and the widespread deployment of learning-based back-end technologies such as digital advertising and intelligent infrastructures, AI (Artificial Intelligence) has moved from research labs to production. These changes have been made possible by unprecedented levels of data and computation, by methodological advances in machine learning, by innovations in systems software and architectures, and by the broad accessibility of these technologies. The next generation of AI systems promises to accelerate these developments and increasingly impact our lives via frequent interactions and making (often mission-critical) decisions on our behalf, often in highly personalized contexts. Realizing this promise, however, raises daunting challenges. In particular, we need AI systems that make timely and safe decisions in unpredictable environments, that are robust against sophisticated adversaries, and that can process ever increasing amounts of data across organizations and individuals without compromising confidentiality. These challenges will be exacerbated by the end of the Moore's Law, which will constrain the amount of data these technologies can store and process. In this paper, we propose several open research directions in systems, architectures, and security that can address these challenges and help unlock AI's potential to improve lives and society. △ Less","15 December, 2017",https://arxiv.org/pdf/1712.05855
Information Processing by Networks of Quantum Decision Makers,V. I. Yukalov;E. P. Yukalova;D. Sornette,"We suggest a model of a multi-agent society of decision makers taking decisions being based on two criteria, one is the utility of the prospects and the other is the attractiveness of the considered prospects. The model is the generalization of quantum decision theory, developed earlier for single decision makers realizing one-step decisions, in two principal aspects. First, several decision makers are considered simultaneously, who interact with each other through information exchange. Second, a multistep procedure is treated, when the agents exchange information many times. Several decision makers exchanging information and forming their judgement, using quantum rules, form a kind of a quantum information network, where collective decisions develop in time as a result of information exchange. In addition to characterizing collective decisions that arise in human societies, such networks can describe dynamical processes occurring in artificial quantum intelligence composed of several parts or in a cluster of quantum computers. The practical usage of the theory is illustrated on the dynamic disjunction effect for which three quantitative predictions are made: (i) the probabilistic behavior of decision makers at the initial stage of the process is described; (ii) the decrease of the difference between the initial prospect probabilities and the related utility factors is proved; (iii) the existence of a common consensus after multiple exchange of information is predicted. The predicted numerical values are in very good agreement with empirical data. △ Less","15 December, 2017",https://arxiv.org/pdf/1712.05734
